"7658","TPG SoftBank China Joint Venture Capital Fund","TPG SoftBank China Joint Venture Capital Fund","TPG軟銀中國合資創投基金","TPG軟銀中國合資創投基金",0,"TPG Growth, SoftBank Ventures Asia Corp. (formerly known as SoftBank Ventures Korea)","TPG Growth, SoftBank Ventures Asia Corp",,,0,0,0,"Joint Venture (Foreign-Foreign)",6,"USA","201809",1,,13,,,,,"201809",0,0,0,0,0,0,0,0,0,"3) Final Closing Achieved already","Closed",300,,,,,0,,,"Yes",157,,"Yes",,,"09/21/18 00:00:00","10/30/21 18:45:47","hlo",0,0,300,0,"202309",0,4,0,1,0,0,0,0,,0,0
"767","Carlyle Japan Venture Partners LP","Carlyle Japan Venture Partners LP",,,0,"The Carlyle Group","The Carlyle Group",,,0,0,0,,1,"Japan","2000",1,,18,,,,,"2000",0,0,0,0,0,0,0,0,0,"4) Cancelled","N/A",199,,"JPY",25000,,0,,,"No",,,"No",,5,"12/09/06 00:00:00","03/23/17 19:24:57","hlo",0,0,,,,0,,0,0,0,0,0,0,,0,0
"7674","General Atlantic Investment Partners 2017, L.P.","General Atlantic Investment Partners 2017 LP",,,0,"General Atlantic LLC","General Atlantic LLC",,,0,0,0,,1,"USA","201710",2,,1,,,,,"201804",0,0,0,0,0,0,0,0,0,"3) Final Closing Achieved already","Closed",,,,,,0,,,"Yes",,,"Yes",,,"10/03/18 00:00:00","01/06/23 11:52:00","hlo",0,0,3289,0,"202304",0,9,0,0,0,0,0,0,,0,0
"7675","General Atlantic Investment Partners 2013, L.P.","General Atlantic Investment Partners 2013 LP",,,0,"General Atlantic LLC","General Atlantic LLC",,,0,0,0,,1,"USA","201303",2,,1,,,,,"201307",0,0,0,0,0,0,0,0,0,"3) Final Closing Achieved already","Closed",,,,,,0,,,"Yes",,,"Yes",,,"10/03/18 00:00:00","10/03/18 18:41:16","hlo",0,0,930,0,"201804",0,6,0,0,0,0,0,0,,0,0
"7676","General Atlantic Investment Partners I, L.P.","General Atlantic Investment Partners I LP",,,1,"General Atlantic LLC","General Atlantic LLC",,,0,0,0,,1,"USA","200805",2,,1,,,,,"200810",0,0,0,0,0,0,0,0,0,"3) Final Closing Achieved already","Closed",850,,,,,0,,,"Yes",,,"Yes",,,"10/03/18 00:00:00","10/03/18 18:58:47","hlo",0,0,,,,0,5,0,0,0,0,0,1,"201805",0,0
"7678","Evolution Fund I, L.P.","Evolution Fund I LP",,,0,"5Y Capital (formerly known as Morningside Venture Capital)","5Y Capital","五源資本","五源資本",0,1,0,"Local",3,"China","201809",1,,13,,,,,"201810",0,0,0,0,0,0,0,0,0,"3) Final Closing Achieved already","Closed",600,,,,,0,,,"Yes",57,,"Yes",,,"10/04/18 00:00:00","08/08/22 13:57:51","hlo",0,0,600,0,"202310",0,5,0,1,0,0,0,0,,0,0
"7679","Evolution Fund I Co-investment, L.P.","Evolution Fund I Co-investment LP",,,0,"5Y Capital (formerly known as Morningside Venture Capital)","5Y Capital","五源資本","五源資本",0,1,0,"Local",3,"China","201809",1,,13,,,,,"201810",0,0,0,0,0,0,0,0,0,"3) Final Closing Achieved already","Closed",135,,,,,0,,,"Yes",57,,"Yes",,,"10/04/18 00:00:00","12/30/20 18:21:37","hlo",0,0,86.699997,50.700001,"202112",0,3,0,1,0,0,0,0,,0,0
"7680","Evolution Special Opportunity Fund I, L.P.","Evolution Special Opportunity Fund I LP",,,0,"5Y Capital (formerly known as Morningside Venture Capital)","5Y Capital","五源資本","五源資本",0,1,0,"Local",3,"China","201809",21,,13,,,,,"201810",0,0,0,0,0,0,0,0,0,"3) Final Closing Achieved already","Closed",300,,,,,0,,,"Yes",57,,"Yes",,,"10/04/18 00:00:00","08/10/22 09:28:21","hlo",0,0,300,0,"202310",0,4,0,1,0,0,0,0,,0,0
"7706","Bessemer Venture Partners X Institutional L.P. (BVP X)","Bessemer Venture Partners X Institutional LP (BVP X)",,,0,"Bessemer Venture Partners (BVP)","Bessemer Venture Partners (BVP)",,,0,0,0,,1,"USA","201808",18,,1,"VC & Growth",,,,"201810",0,0,0,0,0,0,0,0,0,"3) Final Closing Achieved already","Closed",,,,,,0,,,"Yes",,,"Yes",,,"10/26/18 00:00:00","01/06/23 13:38:49","hlo",0,0,1850,0,"202310",0,7,0,0,0,0,0,0,,0,0
"7710","MBK Special Situations Fund I","MBK Special Situations Fund I",,,0,"MBK Partners Ltd.","MBK Partners Ltd",,,0,0,0,,2,"South Korea","201711",8,,58,"China, Japan & South Korea",,,,"201803",0,0,0,0,0,0,0,0,0,"3) Final Closing Achieved already","Closed",750,,,,,0,,,"Yes",,,"Yes",,,"10/30/18 00:00:00","02/23/23 15:35:38","hlo",1,0,850,0,"202207",0,6,0,0,0,0,0,0,,0,0
"7715","Mizuho Growth Support No. 3 Investment Business Limited Partnership","Mizuho Growth Support No. 3 Investment Business LP","みずほ成長支援第 3 号投資事業有限責任組合","みずほ成長支援第 3 号投資事業有限責任組合",0,"Mizuho Capital Co. Ltd.","Mizuho Capital Co Ltd","みずほキャピタルパートナーズ株式会社","みずほキャピタルパートナーズ株式会社",0,0,0,"Local",3,"Japan","201809",1,,18,,,,,"201809",0,1,0,0,0,0,0,0,0,"3) Final Closing Achieved already","Closed",,,,,,0,,,"Yes",,,"Yes",,5,"10/31/18 00:00:00","01/18/22 17:06:51","hlo",0,0,57.5,28.700001,"202201",0,2,0,0,0,0,0,0,,0,0
"7716","Mizuho Growth Support No. 2 Investment Business Limited Partnership","Mizuho Growth Support No. 2 Investment Business LP","みずほ成長支援第 2 号投資事業有限責任組合","みずほ成長支援第 2 号投資事業有限責任組合",0,"Mizuho Capital Co. Ltd.","Mizuho Capital Co Ltd","みずほキャピタルパートナーズ株式会社","みずほキャピタルパートナーズ株式会社",0,0,0,"Local",3,"Japan","201609",1,,18,,,,,"201609",0,1,0,0,0,0,0,0,0,"3) Final Closing Achieved already","Closed",,,,,,0,,,"Yes",,,"Yes",,5,"10/31/18 00:00:00","06/10/21 16:52:53","hlo",0,0,88,0,"201809",0,2,0,0,0,0,0,0,,0,0
"7727","SMBC Venture Capital Investment No.4 LP","SMBC Venture Capital Investment No.4 LP","	SMBCベンチャーキャピタル4号投資事業有限責任組合","	SMBCベンチャーキャピタル4号投資事業有限責任組合",0,"SMBC Venture Capital","SMBC Venture Capital","SMBCベンチャーキャピタル株式会社","SMBCベンチャーキャピタル株式会社",0,0,0,"Local",3,"Japan","201801",1,,18,,,,,"201801",0,0,0,0,0,0,0,0,0,"3) Final Closing Achieved already","Closed",,,,,,0,,,"Yes",,,"Yes",,5,"11/06/18 00:00:00","11/27/19 14:43:58","hlo",0,0,0,0,"N/A",0,13,0,0,0,0,0,0,,0,0
"7739","KKR Asia Pacific Infrastructure Investors SCSp","KKR Asia Pacific Infrastructure Investors SCSp",,,0,"KKR Hong Kong Ltd.","KKR Hong Kong Ltd",,,0,0,0,,1,"Hong Kong","201911",6,,3,,,,,"202012",0,0,0,0,0,0,0,0,0,"3) Final Closing Achieved already","Closed",3000,,,,,0,,,"Yes",148,2,"Yes",,,"11/15/18 00:00:00","12/12/22 14:56:12","hlo",1,0,3900,0,"202210",0,9,0,1,1,0,0,0,,0,0
"7744","KKR Asia Real Estate Partners SCSp","KKR Asia Real Estate Partners SCSp",,,0,"KKR Hong Kong Ltd","KKR Hong Kong Ltd",,,0,0,0,,1,"Hong Kong","201902",10,,3,,,,,"202012",0,0,0,0,0,0,0,0,0,"3) Final Closing Achieved already","Closed",1500,,,,,0,,,"No",103,,"No",,,"11/19/18 00:00:00","01/14/21 10:55:42","hlo",0,0,0,0,"N/A",0,7,0,1,0,0,0,0,,0,0
"7745","Warburg Pincus Global Growth, L.P. (Fund XIII)","Warburg Pincus Global Growth LP (Fund XIII)",,,0,"Warburg Pincus LLC","Warburg Pincus LLC",,,0,0,0,,1,"USA","201806",2,,1,"49% of commitments outside the U.S. and Developed Europe","12",,"203006","201812",0,0,0,0,0,0,0,0,0,"3) Final Closing Achieved already","Closed",13750,,,,,0,,"Mgt Fee: 1.4% on commitments during the investment period; 1.4%  on net invested capital through year eight; 1.25% on net invested capital through year ten, and 1% on net invested capital thereafter
6 years investment period
Net 15% - 18% IRR and 2.0x invested capital
Invests in Energy, Financial Services, Healthcare & Consumer, Industrial & Business Services, and Technology, Media, & Telecommunications","Yes",,,"Yes",,,"11/20/18 00:00:00","01/31/23 11:34:06","hlo",1,0,14800,0,"202312",0,12,0,0,0,0,0,0,,0,0
"775","TMCAP 2000 LP","TMCAP 2000 LP",,,0,"T Capital Partners Co., Ltd. (formerly known as Tokio Marine Capital Co., Ltd.)","T Capital Partners Co Ltd","ティーキャピタルパートナーズ株式会社 (formerly known as 東京海上キャピタル株式会社)","ティーキャピタルパートナーズ株式会社",0,0,0,"Local",3,"Japan","2000",4,,18,,,,,"2001",0,0,0,0,0,0,0,0,0,"3) Final Closing Achieved already","Closed",159,239,"JPY",20000,30000,0,,,"Yes",,,"Yes",,5,"12/09/06 00:00:00","09/25/19 17:49:03","hlo",0,0,,,,0,,0,0,0,0,0,0,,0,0
"7755","Boyu Capital Fund IV, L.P.","Boyu Capital Fund IV LP",,,0,"Boyu Capital Advisory Co., Ltd.","Boyu Capital Advisory Co Ltd","博裕投資顧問有限公司","博裕投資顧問有限公司",0,1,0,"Local",3,"China","201811",2,,13,,,,,"201903",0,0,0,0,0,0,0,0,0,"3) Final Closing Achieved already","Closed",3000,4000,,,,0,,,"Yes",,,"Yes",,,"11/26/18 00:00:00","07/26/22 18:26:23","hlo",0,0,3600,0,"202403",0,9,0,0,0,0,0,0,,0,0
"7756","(Unknown - US$600 m fund)","(Unknown - US$600 m fund)",,,0,"Legend Capital","Legend Capital","君聯資本","君聯資本",0,1,0,"Local",3,"China","201811",1,,3,"China",,,,"N/A",0,0,0,0,0,0,0,0,0,"2) Still in fund raising process","Raising",600,,,,,0,,,"Yes",50,,"Yes",,,"11/26/18 00:00:00","11/26/18 14:17:01","dsin",0,0,,,,0,5,0,1,0,0,0,0,,0,0
"7790","KKR Global Impact Fund SCSp","KKR Global Impact Fund SCSp",,,0,"KKR & Co.","KKR & Co",,,0,0,0,,1,"USA","201808",2,,1,"Americas, Europe & Asia",,,,"202002",0,0,0,0,0,0,0,0,0,"3) Final Closing Achieved already","Closed",1000,,,,,0,,"Industrial and infrastructure solutions, responsible production and consumption, environment management, next generation energy, as well as learning resources and workforce development","Yes",,14,"Yes",,,"12/13/18 00:00:00","01/06/23 11:44:36","hlo",1,0,1300,0,"202412",0,7,0,0,1,0,0,0,,0,0
"7791","SSG Capital Partners V, L.P.","SSG Capital Partners V LP",,,0,"Ares SSG (formerlly known as SSG Capital Management Limited)","Ares SSG",,,0,0,0,,2,"Hong Kong","201812",8,"60% distress, 40% special situations",3,"India, China, Southeast Asia",,,,"201901",0,0,0,0,0,0,0,0,0,"3) Final Closing Achieved already","Closed",1500,,,,,0,,,"Yes",,,"Yes",,,"12/14/18 00:00:00","07/27/22 18:55:42","hlo",1,0,1800,0,"202210",0,7,0,0,0,0,0,0,,0,0
"7793","(Unknown - a US$5 bn JV in Distressed Chinese Property Assets)","N/A",,,0,"Warburg Pincus LLC, Hande Group","Warburg Pincus LLC, Hande Group","華平投資, 翰德集團","華平投資, 翰德集團",0,0,0,"Joint Venture (Local-Foreign)",4,"USA, China","201812",27,,13,,,,,"201812",0,0,0,0,0,0,0,0,0,"2) Still in fund raising process","Raising",5000,,,,,0,,,"No",103,,"No",,,"12/14/18 00:00:00","12/14/18 11:47:58","hlo",0,0,,,,0,11,0,1,0,0,0,0,,0,0
"7806","(Unknown - JV Platform for Urban Renewal Opportunities)","N/A",,,0,"Warburg Pincus LLC, Shanghai Creater Industrial Co., Ltd. (CREATER)","Warburg Pincus LLC, Shanghai Creater Industrial Co Ltd (CREATER)","華平投資, 上海創邑實業股份有限公司 (CREATER創邑)","華平投資, 上海創邑實業股份有限公司 (CREATER創邑)",0,0,0,"Joint Venture (Local-Foreign)",4,"USA,","201812",27,,13,,,,,"201812",0,0,0,0,0,0,0,0,0,"2) Still in fund raising process","Raising",2000,,,,,0,,"US$300 m inlcudes the an equity investment in CREATER at the corporate level and establish a new acquisition joint venture","No",103,,"No",,,"12/28/18 00:00:00","12/28/18 14:01:32","hlo",0,0,,,,0,8,0,1,0,0,0,0,,0,0
"7807","Hamstede Living Private Limited","Hamstcde Living Pvt Ltd",,,0,"Warburg Pincus LLC, Lemon Tree Hotels Limited","Warburg Pincus LLC, Lemon Tree Hotels Ltd",,,0,0,0,"Joint Venture (Local-Foreign)",4,"USA, India","201812",27,,15,,,,,"201812",0,0,0,0,0,0,0,0,0,"2) Still in fund raising process","Raising",428.60001,,"INR",30000,,0,,"Construct, acquire, develop, operate and lease short— and long—stay real estate projects, with a primary focus on student housing, co-living for working professionals/adults and multi~family users.

An affiliate of Warburg Pincus and Lemon Tree Hotels Limited will hold 68% and 30% stake, respectively in the JV, with the balance 2% to be held by Mr. Patanjali Keswani.","No",192,,"No",,2,"12/28/18 00:00:00","12/28/18 15:14:11","hlo",0,0,,,,0,4,0,1,0,0,0,0,,0,0
"7816","DCP China Credit Fund II, L.P.","DCP China Credit Fund II LP",,,0,"Dignari Capital Partners (HK) Limited","Dignari Capital Partners (HK) Ltd","冰源資本有限公司","冰源資本有限公司",0,0,0,"Local",3,"Hong Kong","201801",8,,13,,,,,"201905",0,0,0,0,0,0,0,0,0,"3) Final Closing Achieved already","Closed",500,,,,,0,,,"Yes",,,"Yes",,,"01/10/19 00:00:00","02/15/23 16:50:11","hlo",1,0,626.09998,0,"202405",0,5,0,0,0,0,0,0,,0,0
"7817","DCP China Credit Fund II Feeder I, L.P.","DCP China Credit Fund II Feeder I LP",,,0,"Dignari Capital Partners (HK) Limited","Dignari Capital Partners (HK) Ltd","冰源資本有限公司","冰源資本有限公司",0,0,0,"Local",3,"Hong Kong","201801",8,,13,,,,,"N/A",0,0,0,0,0,0,0,0,0,"2) Still in fund raising process","Raising",500,,,,,0,,,"Yes",,,"Yes",,,"01/10/19 00:00:00","01/10/19 14:41:19","hlo",0,0,,,,0,5,0,0,0,0,0,0,,0,0
"7818","DCP China Credit Fund I, L.P.","DCP China Credit Fund I LP",,,1,"Dignari Capital Partners (HK) Limited","Dignari Capital Partners (HK) Ltd","冰源資本有限公司","冰源資本有限公司",0,0,0,"Local",3,"Hong Kong","201412",8,,13,,,,,"201412",0,0,0,0,0,0,0,0,0,"3) Final Closing Achieved already","Closed",350,,,,,0,,,"Yes",,,"Yes",,,"01/10/19 00:00:00","01/11/19 14:24:18","hlo",0,0,66.900002,0,"201712",0,4,0,0,0,0,0,0,,0,0
"7821","China Synergy Platform","China Synergy Platform",,,0,"TPG, CICC Capital","TPG, CICC Capital",,,0,0,0,"Joint Venture (Local-Foreign)",4,"USA, China","201901",27,,55,,,,,,0,1,0,0,0,0,0,0,0,,"N/A",,,,,,0,,,"No",,,"No",,,"01/11/19 00:00:00","04/25/19 09:37:10","hlo",0,0,,,,0,,0,0,0,0,0,0,,0,0
"7824","Ascent Myanmar Growth Fund I L.P.","Ascent Myanmar Growth Fund I LP",,,1,"Ascent Capital Partners Pte. Ltd.","Ascent Capital Partners Pte Ltd",,,0,0,0,"Foreign",3,"Singapore","201812",2,,52,,"12","1+1","203012","202011",0,0,0,0,0,0,0,0,0,"3) Final Closing Achieved already","Closed",50,100,,,,0,,,"Yes",,,"Yes",,,"01/15/19 00:00:00","11/12/20 18:38:28","blam",0,0,88,0,"202511",0,3,0,0,0,0,0,0,,0,0
"7834","Eight Roads Ventures India III LP","Eight Roads Ventures India III LP",,,0,"Eight Roads Ventures","Eight Roads Ventures",,,0,0,0,"Foreign",1,"India","201712",1,,15,,,,,"201712",0,1,0,0,0,0,0,0,0,"3) Final Closing Achieved already","Closed",,,,,,0,,,"Yes",,,"Yes",,,"01/24/19 00:00:00","01/25/19 15:55:28","hlo",0,0,0,0,"N/A",0,13,0,0,0,0,0,0,,0,0
"7835","SB Global Champ Fund","SB Global Champ Fund",,,0,"SoftBank Ventures Asia (Formerly known as SoftBank Ventures Korea)","SoftBank Ventures Asia",,,0,0,0,,1,"South Korea","201712",29,"Early to Growth",1,,"8",,"202512","201712",0,0,0,0,0,0,0,0,0,"3) Final Closing Achieved already","Closed",70.800003,,"KRW",80000,,0,,"Investment period: 4 yrs","Yes",,,"Yes",,6,"01/24/19 00:00:00","12/03/21 20:27:15","hlo",1,0,88.699997,16.5,"202107",0,3,0,0,0,0,0,0,,0,0
"7852","(unknown - distressed asset fund)","(unknown - distressed asset fund)",,,0,"CITIC Capital Partners","CITIC Capital Partners","中信資本有限公司","中信資本有限公司",0,0,0,"Local",3,"China","201901",17,"distressed asset, mainly in real estate",13,,,,,"N/A",0,0,0,0,0,0,0,0,0,"2) Still in fund raising process","Raising",500,,,,,0,,,"No",103,,"No",,,"01/29/19 00:00:00","05/10/19 12:49:55","dsin",0,0,,,,0,5,0,1,0,0,0,0,,0,0
"7859","Qiming U.S. Healthcare Fund II, L.P.","Qiming US Healthcare Fund II LP",,,0,"Qiming Venture Partners USA","Qiming Venture Partners USA",,,0,0,0,,1,"USA","201901",1,,2,"USA & Europe",,,,"N/A",0,0,0,0,0,0,0,0,0,"3) Final Closing Achieved already","Closed",250,,,,,0,,,"Yes",50,,"No",,,"02/01/19 00:00:00","02/26/25 19:10:05","hlo",0,0,,,,0,4,0,1,0,0,0,0,,0,0
"7860","Hony Capital Fund IX LP","Hony Capital Fund IX LP",,,0,"Hony Capital","Hony Capital","弘毅投資","弘毅投資",0,0,0,"Local",3,"China","201901",4,,13,,,,,"N/A",0,0,0,0,0,0,0,0,0,"6) No further info","N/A",,,,,,0,,,"No",,,"No",,,"02/01/19 00:00:00","03/24/25 17:40:30","hlo",0,0,,,,0,13,0,0,0,0,0,0,,0,0
"7864","PAG Special Situations Fund III L.P. (formerly known as PAG Asia Special Situations Fund III L.P.
)","PAG Special Situations Fund III LP",,,0,"PAG Asia Capital","PAG Asia Capital",,,0,0,0,,2,"Hong Kong","201901",8,,3,,,,,"N/A",0,0,0,0,0,0,0,0,0,"3) Final Closing Achieved already","Closed",1000,,,,,0,,,"Yes",103,,"Yes",,,"02/11/19 00:00:00","12/14/22 09:45:28","hlo",0,0,,,,0,7,0,1,0,0,0,0,,0,0
"7872","IMM RoseGold IV","IMM RoseGold IV",,,0,"IMM Private Equity, Inc.","IMM Private Equity Inc",,,0,0,0,"Local",3,"South Korea","201902",18,,25,,,,,"201912",0,0,0,0,0,0,0,0,0,"3) Final Closing Achieved already","Closed",,,,,,0,,,"Yes",,,"Yes",,6,"02/19/19 00:00:00","01/02/24 22:36:07","hlo",0,0,1390.6,140.3,"202208",0,7,0,0,0,0,0,0,,0,0
"7888","GS Capital Partners III LP","GS Capital Partners III LP",,,0,"Goldman Sachs Capital Partners","Goldman Sachs Capital Partners",,,0,0,0,,1,"USA","199812",4,,1,,,,,"199812",0,0,0,0,0,0,0,0,0,"3) Final Closing Achieved already","Closed",,,,,,0,,,"Yes",,,"Yes",,,"02/26/19 00:00:00","02/26/19 15:23:31","hlo",0,0,,,,0,8,0,0,0,0,0,0,,0,0
"7908","IMM Venture Fund 2018","IMM Venture Fund 2018","2018 IMM 벤처펀드","2018 IMM 벤처펀드",0,"IMM Investment Corp.","IMM Investment Corp","IMM인베스트","IMM인베스트",0,0,0,"Local",3,"South Korea","201812",1,,25,,"7",,"202512","201812",0,0,0,0,0,0,0,0,0,"3) Final Closing Achieved already","Closed",,,,,,0,,,"Yes",,,"Yes",,6,"02/27/19 00:00:00","01/18/22 17:35:30","hlo",0,0,67.900002,27.1,"202201",0,3,0,0,0,0,0,0,,0,0
"7911","	IMM Secondary Venture Fund No.3","	IMM Secondary Venture Fund No.3","MM 세컨더리 벤처펀드 제3호","MM 세컨더리 벤처펀드 제3호",0,"IMM Investment Corp.","IMM Investment Corp","IMM인베스트","IMM인베스트",0,0,0,"Local",3,"South Korea","201804",5,"Secondary VC",25,,"8",,"202604","201804",0,0,0,0,0,0,0,0,0,"3) Final Closing Achieved already","Closed",,,,,,0,,,"Yes",,,"Yes",,6,"02/28/19 00:00:00","12/18/20 17:43:25","hlo",0,0,36.299999,24.1,"202012",0,2,0,0,0,0,0,0,,0,0
"7912","	IMM Secondary Venture Fund No.2","IMM Secondary Venture Fund No.2","	IMM 세컨더리 벤처펀드 제2호","	IMM 세컨더리 벤처펀드 제2호",0,"IMM Investment Corp.","IMM Investment Corp","IMM인베스트","IMM인베스트",0,0,0,"Local",3,"South Korea","201706",5,"Secondary VC",25,,"5",,"202206","201706",0,0,0,0,0,0,0,0,0,"3) Final Closing Achieved already","Closed",,,,,,0,,,"Yes",,,"Yes",,6,"02/28/19 00:00:00","02/28/19 15:23:43","hlo",0,0,15.3,0,"201804",0,1,0,0,0,0,0,0,,0,0
"7913","2016 KIF-IMM Woori Bank Technology Finance Fund","2016 KIF-IMM Woori Bank Technology Finance Fund","	2016 KIF-IMM 우리은행 기술금융펀드","	2016 KIF-IMM 우리은행 기술금융펀드",0,"IMM Investment Corp.","IMM Investment Corp","IMM인베스트","IMM인베스트",0,0,0,"Local",3,"South Korea","201610",1,,25,,"7",,"202310","201610",0,0,0,0,0,0,0,0,0,"3) Final Closing Achieved already","Closed",,,,,,0,,,"Yes",,,"Yes",,6,"02/28/19 00:00:00","12/18/21 15:57:07","hlo",0,0,62.5,0,"202006",0,2,0,0,0,0,0,0,,0,0
"7914","	IMM Secondary Venture Fund No.1","IMM Secondary Venture Fund No.1","IMM 세컨더리 벤처펀드 제1호","IMM 세컨더리 벤처펀드 제1호",0,"IMM Investment Corp.","IMM Investment Corp","IMM인베스트","IMM인베스트",0,0,0,"Local",3,"South Korea","201605",5,"Secondary VC",25,,"5",,"202105","201605",0,0,0,0,0,0,0,0,0,"3) Final Closing Achieved already","Closed",,,,,,0,,,"Yes",,,"Yes",,6,"02/28/19 00:00:00","02/28/19 17:34:33","hlo",0,0,22.200001,0,"201706",0,1,0,0,0,0,0,0,,0,0
"7916","IMM Infrastructure No.6","IMM Infrastructure No.6","아이엠엠인프라제6호","아이엠엠인프라제6호",0,"IMM Investment Corp.","IMM Investment Corp","IMM인베스트","IMM인베스트",0,0,0,"Local",3,"South Korea","201604",6,,25,,,,,"201604",0,0,0,0,0,0,0,0,0,"3) Final Closing Achieved already","Closed",,,,,,0,,,"Yes",148,,"Yes",,6,"02/28/19 00:00:00","01/02/20 16:34:46","hlo",0,0,96,19.200001,"202006",0,3,0,1,0,0,0,0,,0,0
"7917","Etra","Etra","에트라","에트라",0,"IMM Investment Corp.","IMM Investment Corp","IMM인베스트","IMM인베스트",0,0,0,"Local",3,"South Korea","201603",4,,25,,,,,"201603",0,0,0,0,0,0,0,0,0,"3) Final Closing Achieved already","Closed",,,,,,0,,,"Yes",,,"Yes",,6,"02/28/19 00:00:00","01/06/20 17:26:54","hlo",0,0,45,8.1000004,"202006",0,2,0,0,0,0,0,0,,0,0
"7919","IMM Infrastructure No.5","IMM Infrastructure No.5","아이엠엠인프라 제5호","아이엠엠인프라 제5호",0,"IMM Investment Corp.","IMM Investment Corp","IMM인베스트","IMM인베스트",0,0,0,"Local",3,"South Korea","201411",6,,25,,,,,"201411",0,0,0,0,0,0,0,0,0,"3) Final Closing Achieved already","Closed",,,,,,0,,,"Yes",148,,"Yes",,6,"02/28/19 00:00:00","02/28/19 19:54:10","hlo",0,0,190,0,"201604",0,3,0,1,0,0,0,0,,0,0
"7920","IMM Infrastructure No.4","IMM Infrastructure No.4","아이엠엠인프라 제4호","아이엠엠인프라 제4호",0,"IMM Investment Corp.","IMM Investment Corp","IMM인베스트","IMM인베스트",0,0,0,"Local",3,"South Korea","201406",6,,25,,,,,"201406",0,0,0,0,0,0,0,0,0,"3) Final Closing Achieved already","Closed",,,,,,0,,,"Yes",148,,"Yes",,6,"02/28/19 00:00:00","02/28/19 20:04:35","hlo",0,0,109.8,0,"201604",0,3,0,1,0,0,0,0,,0,0
"7925","IMM Infrastructure","IMM Infrastructure","아이엠엠인프라","아이엠엠인프라",0,"IMM Investment Corp.","IMM Investment Corp","IMM인베스트","IMM인베스트",0,0,0,"Local",3,"South Korea","201307",6,,25,,,,,"201307",0,0,0,0,0,0,0,0,0,"3) Final Closing Achieved already","Closed",,,,,,0,,,"Yes",148,,"Yes",,6,"03/01/19 00:00:00","03/01/19 14:59:04","hlo",0,0,152.5,0,"201406",0,3,0,1,0,0,0,0,,0,0
"7926","IMM Corporation Partnership No.1","IMM Corporation Partnership No.1","아이엠엠코퍼릿파트너쉽제1호","아이엠엠코퍼릿파트너쉽제1호",0,"IMM Investment Corp.","IMM Investment Corp","IMM인베스트","IMM인베스트",0,0,0,"Local",3,"South Korea","201205",4,,25,,,,,"201205",0,0,0,0,0,0,0,0,0,"3) Final Closing Achieved already","Closed",,,,,,0,,,"Yes",,,"Yes",,6,"03/01/19 00:00:00","03/01/19 15:21:06","hlo",0,0,65,0,"201705",0,2,0,0,0,0,0,0,,0,0
"7927","IMM Investment No.3","IMM Investment No.3","아이엠엠인베스트먼트3호","아이엠엠인베스트먼트3호",0,"IMM Investment Corp.","IMM Investment Corp","IMM인베스트","IMM인베스트",0,0,0,"Local",3,"South Korea","201112",4,,25,,,,,"201112",0,0,0,0,0,0,0,0,0,"3) Final Closing Achieved already","Closed",,,,,,0,,,"Yes",,,"Yes",,6,"03/01/19 00:00:00","03/01/19 15:32:24","hlo",0,0,37.400002,0,"201612",0,1,0,0,0,0,0,0,,0,0
"7929","(unknown - logistics and healthcare USD fund)","(unknown)",,,0,"CDH Venture and Growth Capital","CDH Venture and Growth Capital",,,0,1,0,"Local",3,"China",,1,,13,,,,,"N/A",0,0,0,0,0,0,0,0,0,"1) To be launched","To be launched",500,,,,,0,,"sector focus includes logistics and healthcare","Yes",,,"Yes",,,"03/05/19 00:00:00","03/05/19 14:44:44","dsin",0,0,,,,0,5,0,0,0,0,0,0,,0,0
"7930","(unknown - logistics and healthcare RMB fund)","(unknown)",,,0,"CDH Venture and Growth Capital","CDH Venture and Growth Capital",,,0,1,0,"Local",3,"China",,1,,13,,,,,"N/A",0,0,0,0,0,0,0,0,0,"1) To be launched","To be launched",447.39999,,"RMB",3000,,0,,"sector focus includes logistics and healthcare","Yes",,,"Yes",,1,"03/05/19 00:00:00","03/05/19 14:45:19","dsin",0,0,,,,0,4,0,0,0,0,0,0,,0,0
"7935","Adjuvant Global Health Technology Fund L.P.","Adjuvant Global Health Technology Fund LP",,,0,"Adjuvant Capital GP L.P.","Adjuvant Capital GP LP",,,0,0,0,,1,"USA","201903",3,"make equity, mezzanine & debt investments",1,,"10",,"202903","202102",0,0,0,0,0,0,0,0,0,"3) Final Closing Achieved already","Closed",200,300,,,,0,,,"Yes",191,14,"Yes",,,"03/06/19 00:00:00","02/25/21 16:18:13","hlo",1,0,205,95,"202212",0,4,0,1,1,0,0,0,,0,0
"7939","SoftBank Innovation Fund","SoftBank Innovation Fund",,,0,"SoftBank Group Corp.","SoftBank Group Corp",,,0,0,0,,1,"Japan","201903",18,,46,"Argentina, Brazil, Chile, Colombia & Mexico",,,,"N/A",0,0,0,0,0,0,0,0,0,"2) Still in fund raising process","Raising",5000,,,,,0,,,"Yes",57,,"No",,,"03/08/19 00:00:00","03/08/19 10:02:26","hlo",0,0,,,,0,11,0,1,0,0,0,0,,0,0
"7947","EQT Infrastructure IV","EQT Infrastructure IV",,,0,"EQT Partners","EQT Partners",,,0,0,0,,1,"Sweden","201809",6,,1,"primarily invest in Europe & North America; may opportunistically explore opportunities in Asia Pacific",,,,"201903",0,0,0,0,0,0,0,0,0,"3) Final Closing Achieved already","Closed",10441.1,,"EUR",9000,,0,,,"Yes",148,,"Yes",,19,"03/14/19 00:00:00","08/01/22 17:50:15","hlo",1,0,10146.6,0,"202111",0,12,0,1,0,0,0,0,,0,0
"795","S.I. Technology Fund","S.I. Technology Fund",,,0,"Vertex Management","Vertex Management",,,0,0,0,"Foreign",1,"Singapore","2000",1,,13,,,,,"2000",0,1,0,0,0,1,0,0,0,"3) Final Closing Achieved already","Closed",20,,,,,0,,,"Yes",,,"Yes",,,"12/09/06 00:00:00","12/09/06 00:00:00",,0,0,,,,0,,0,0,0,0,0,0,,0,0
"7963","Sinopharm-CICC Healthcare Industrial Fund","Sinopharm-CICC Healthcare Industrial Fund","國藥中金醫療產業基金","國藥中金醫療產業基金",0,"Sinopharm-CICC (Shanghai) Healthcare Investment Management Co., Ltd.","Sinopharm-CICC (Shanghai) Healthcare Investment Management Co., Ltd.","國藥中金(上海)醫療健康投資管理有限公司","國藥中金(上海)醫療健康投資管理有限公司",0,0,0,"Joint Venture (Local-Local)",5,"China, China","201611",1,,13,,"5","2","202111","201701",0,0,0,0,0,0,0,0,0,"3) Final Closing Achieved already","Closed",439.29999,,"RMB",3000,,0,,,"Yes",50,,"Yes",,1,"04/02/19 00:00:00","03/12/21 14:21:35","hlo",0,0,84.900002,14.4,"202012",0,4,0,1,0,0,0,0,,0,0
"7967","Blackstone Capital Partners VIII L.P.","Blackstone Capital Partners VIII LP",,,0,"Blackstone Inc","Blackstone Inc",,,0,0,0,,1,"USA","201812",4,,1,,,,,"201903",0,0,0,0,0,0,0,0,0,"3) Final Closing Achieved already","Closed",20000,25000,,,,0,,,"Yes",,,"Yes",,,"04/09/19 00:00:00","07/20/22 19:23:52","hlo",1,0,26000,0,"202403",0,12,0,0,0,0,0,0,,0,0
