"2032","Qiming Healthcare RMB Fund","Qiming Healthcare RMB Fund",,,0,"Qiming Weichuang Venture Investment Management (Beijing) Co., Ltd.","Qiming Weichuang Venture Investment Management (Beijing) Co., Ltd.","啟明維創創業投資管理(北京)有限公司","啟明維創創業投資管理(北京)有限公司",0,1,0,"Local",3,"China","201005",1,,13,"60% Beijing",,,,"201005",0,0,0,1,0,1,0,0,1,"3) Final Closing Achieved already","Closed",36.599998,,"RMB",250,,0,,,"Yes",50,,"Yes",,1,"10/29/08 00:00:00","06/09/10 00:00:00",,0,0,,,,0,,0,1,0,0,0,0,,0,0
"204","Carlyle Asia Partners, L.P.","Carlyle Asia Partners LP",,,0,"Carlyle Asia Partners","Carlyle Asia Partners",,,0,0,0,,1,"Hong Kong","1999",4,,3,,,,,"1999",0,0,0,0,0,0,0,0,0,"3) Final Closing Achieved already","Closed",,,,,,0,,,"Yes",,,"Yes",,,,"09/26/18 15:22:38","hlo",0,0,,,,0,6,0,0,0,0,0,1,"2009",0,0
"2040","Innovation Capital Fund II","Innovation Capital Fund II",,,0,"Innovation Capital","Innovation Capital",,,0,1,0,"Local",3,"Australia","2007",2,,10,,,,,"2007",0,0,0,0,0,0,0,0,0,"3) Final Closing Achieved already","Closed",,,,,,0,,,"Yes",,,"Yes",,3,"11/03/08 00:00:00","10/25/12 00:00:00",,0,0,,,,0,,0,0,0,0,0,0,,0,0
"206","Carlyle Asia Venture Partners I, L.P.","Carlyle Asia Venture Partners I LP",,,0,"The Carlyle Group","The Carlyle Group",,,0,0,0,,1,"Hong Kong","2000",1,,3,,,,,"2000",0,0,0,0,0,0,0,0,0,"3) Final Closing Achieved already","Closed",,,,,,0,,,"Yes",,,"Yes",,,,"11/09/18 15:56:41","hlo",0,0,,,,0,3,0,0,0,0,0,1,"2010",0,0
"2082","(Unknown - Friendly Activist Fund)","N/A",,,0,"Advantage Partners LLP","Advantage Partners LLP",,,0,1,0,"Local",3,"Japan","200812",4,,18,,,,,"200812",0,0,0,0,0,0,0,0,0,"6) No further info","N/A",,,,,,0,"Do NOT Disclose (request by Fund House)","raised mainly from existing LPs that invest in AP’s previous funds","No",,,"No",,,"12/16/08 00:00:00","11/10/16 12:22:22","hlo",0,0,,,,0,,0,0,0,0,0,0,,0,0
"210","Transpac 1996 Fund","Transpac 1996 Fund",,,0,"Transpac Capital Ltd","Transpac Capital Ltd",,,0,0,0,,2,"Singapore","1996",2,,3,,"10",,"2006","N/A",0,0,0,0,0,0,0,0,0,"6) No further info","N/A",300,,,,,0,,,"Yes",,,"No",,,,"02/14/12 00:00:00",,0,0,,,,0,,0,0,0,0,0,0,,0,0
"2117","Morningside Chenshan (Shanghai) Venture Capital LP","Morningside Chenshan (Shanghai) Venture Capital LP","晨興晨山 (上海) 創業投資企業","晨興晨山 (上海) 創業投資企業",0,"5Y Capital (formerly known as Morningside Venture Capital)","5Y Capital","五源資本","五源資本",0,0,0,"Foreign",3,"China","200809",1,,13,,,,,"200809",0,0,0,0,0,0,0,0,1,"3) Final Closing Achieved already","Closed",14.6,,"RMB",100,,0,,,"Yes",,,"Yes",,1,"01/12/09 00:00:00","12/30/20 18:22:04","hlo",0,0,,,,0,1,0,0,0,0,0,0,,0,0
"2118","CITIC Capital China Real Estate Investment Fund III","CITIC Capital China Real Estate Investment Fund III","中信資本中國房地產發展基金III","中信資本中國房地產發展基金III",0,"CITIC Capital - Real Estate Group","CITIC Capital - Real Estate Group",,,0,0,0,"Local",2,"Hong Kong","200712",10,,13,,,,,"200812",0,0,0,0,0,0,0,0,1,"3) Final Closing Achieved already","Closed",,,,,,0,,,"No",103,,"No",,,"01/13/09 00:00:00","06/13/18 17:50:21","hlo",0,0,,,,0,,0,1,0,0,0,1,"2018",0,0
"2119","CITIC Capital China Property Fund, L.P.","CITIC Capital China Property Fund, L.P.","中信資本中國房地產投資基金","中信資本中國房地產投資基金",0,"CITIC Capital Real Estate Group","CITIC Capital Real Estate Group",,,0,0,0,"Local",2,"Hong Kong","2005",10,,13,,,,,"2005",0,0,0,0,0,0,0,0,0,"3) Final Closing Achieved already","Closed",,,,,,0,,,"No",103,,"No",,,"01/14/09 00:00:00","01/14/09 00:00:00",,0,0,,,,0,,0,1,0,0,0,0,,0,0
"212","China Renaissance Fund","China Renaissance Fund",,,0,"Morningside Asia Advisory Ltd","Morningside Asia Advisory Ltd",,,0,0,0,"Foreign",3,"Hong Kong","1995",2,,13,,,,,"N/A",0,0,0,0,0,0,0,0,0,"5) Inactive","N/A",,,,,,0,,,"No",,,"No",,,,,,0,0,,,,0,,0,0,0,0,0,0,,0,0
"2120","CITIC Capital Vanke China Property Development Fund, L.P.","CITIC Capital Vanke China Property Development Fund, L.P.","中信資本萬科中國房地產開發基金","中信資本萬科中國房地產開發基金",0,"CITIC Capital - Real Estate Group","CITIC Capital - Real Estate Group",,,0,0,0,"Local",2,"Hong Kong","200603",10,,13,,,,,"200603",0,0,0,0,0,0,0,0,0,"3) Final Closing Achieved already","Closed",,,,,,0,,,"No",103,,"No",,,"01/14/09 00:00:00","04/15/09 00:00:00",,0,0,,,,0,,0,1,0,0,0,0,,0,0
"2121","Aditya Birla Private Equity - Fund I","Aditya Birla Private Equity - Fund I",,,1,"Aditya Birla Capital Advisors Private Limited (ABCAP)","Aditya Birla Capital Advisors Private Limited",,,0,0,1,"Local",3,"India","200901",2,,15,,,,,"201001",0,0,0,0,0,0,0,1,0,"3) Final Closing Achieved already","Closed",250,,,,,0,,,"Yes",,,"Yes",,2,"01/14/09 00:00:00","12/18/14 15:11:29","hlo",0,0,,,,0,,0,0,0,0,0,0,,0,0
"2125","Beijing Fangshan Venture Investment Fund","Beijing Fangshan Venture Investment Fund","北京市中科房山創業投資基金有限公司","北京市中科房山創業投資基金有限公司",0,"China Science & Merchants Investment (Fund) Management Co., Ltd","China Science & Merchants Investment (fund) Management Co., Ltd","中科招商創業投資管理有限公司","中科招商創業投資管理有限公司",0,0,0,"Local",3,"China","200901",2,,13,,"15",,"2023","200901",0,1,0,0,0,0,0,1,0,"3) Final Closing Achieved already","Closed",73.099998,,"RMB",500,,0,,,"Yes",,,"Yes",,1,"01/20/09 00:00:00","01/20/09 00:00:00",,0,0,,,,0,,0,0,0,0,0,0,,0,0
"2132","Jupiter Private Equity Inc.","Jupiter Private Equity Inc.",,,0,"IMM Private Equity, Inc.","IMM Private Equity, Inc.",,,0,1,0,"Local",3,"South Korea","200706",2,,25,,,,,"200706",0,0,0,0,0,0,0,0,0,"3) Final Closing Achieved already","Closed",,,,,,0,,,"Yes",110,,"Yes",,6,"01/23/09 00:00:00","07/04/16 10:29:06","hlo",0,0,,,,0,,0,1,0,0,0,0,,0,0
"2133","Primoris Private Equity Inc.","Primoris Private Equity Inc.",,,0,"IMM Private Equity","IMM Private Equity",,,0,1,0,"Local",3,"South Korea","200711",2,,25,,,,,"200711",0,0,0,0,0,0,0,0,0,"3) Final Closing Achieved already","Closed",,,,,,0,,,"Yes",82,,"Yes",,6,"01/23/09 00:00:00","06/13/18 18:36:48","hlo",0,0,,,,0,,0,1,0,0,0,1,"2018",0,0
"2136","Green Energy Technology Fund","Green Energy Technology Fund","綠色能源科技基金","綠色能源科技基金",0,"CITIC International Financial Holdings Limited","CITIC International Financial Holdings Limited","中信國際金融控股有限公司","中信國際金融控股有限公司",0,0,0,"Local",2,"Hong Kong","200901",2,,13,,,,,"N/A",0,1,0,1,0,1,0,0,1,"2) Still in fund raising process","Raising",146.3,219.39999,"RMB",1000,1500,0,,,"No",151,2,"No",,1,"01/23/09 00:00:00","11/29/21 13:19:05","hlo",0,0,,,,0,13,0,1,1,0,0,0,,0,0
"214","AIF Telecom Fund (TVG Asia Communications Fund)","TVG Asia Communications Fund",,,0,"JPMorgan (former TVG Capital Partners, Telecom Venture Group)","JPMorgan",,,0,0,0,,1,"Hong Kong","1997",2,,3,,,,,"N/A",0,0,0,0,0,0,0,0,0,"3) Final Closing Achieved already","Closed",,,,,,0,,,"Yes",123,,"No",,,,"02/14/12 00:00:00",,0,0,,,,0,,0,1,0,0,0,0,,0,0
"2149","Carlyle Asia Partners IV, L.P.","Carlyle Asia Partners IV LP",,,0,"The Carlyle Asia Investment Advisors Ltd.","The Carlyle Asia Investment Advisors Ltd",,,0,1,0,,1,"Hong Kong","201205",4,,3,,,,,"201409",0,0,0,1,0,0,0,0,0,"3) Final Closing Achieved already","Closed",3500,,,,,0,,,"Yes",,,"Yes",,,"02/12/09 00:00:00","06/21/18 15:29:38","hlo",1,0,3900,0,"201812",0,9,0,0,0,0,0,0,,0,0
"216","ARIA Private Equity Partners I","ARIA Private Equity Partners I",,,1,"CLSA Capital Partners (former CLSA Private Equity Ltd.)","CLSA Capital Partners",,,0,1,0,,2,"Hong Kong","199509",2,,3,,,,,"2000",0,0,0,0,0,0,0,0,0,"3) Final Closing Achieved already","Closed",150,,,,,0,,,"Yes",,,"Yes",,,,"05/09/17 09:54:07","hlo",0,0,,,,0,,0,0,0,0,0,0,,0,0
"2169",,,,,0,"The Carlyle Group","The Carlyle Group",,,1,0,0,,1,"USA",,12,,31,,,,,,0,0,0,0,0,0,0,0,0,,"N/A",,,,,,0,,,"No",,,"No",,,"02/24/09 00:00:00","06/05/13 00:00:00",,0,0,,,,0,,0,0,0,0,0,0,,0,0
"2177","CDH China Fund IV","CDH China Fund IV",,,0,"CDH Investments","CDH Investments","鼎輝投資","鼎輝投資",0,1,0,"Local",3,"China","200904",4,,13,,,,,"200911",0,0,0,0,0,0,0,0,0,"3) Final Closing Achieved already","Closed",1200,,,,,0,,"KN (26 Aug, 09): the target size has reduced from US$2 bn to US$1.2 bn","Yes",,,"Yes",,,"03/05/09 00:00:00","10/29/19 12:07:07","hlo",0,0,,,,0,7,0,0,0,0,0,1,"201904",0,0
"2179","KKR Natural Resource Fund","KKR Natural Resource Fund",,,0,"Kohlberg Kravis Roberts & Co. L.P. (KKR)","Kohlberg Kravis Roberts & Co. L.P. (KKR)",,,0,1,0,,1,"USA","201206",2,,1,,,,,"201206",0,0,0,1,0,0,0,0,0,"3) Final Closing Achieved already","Closed",,,,,,0,,,"Yes",89,,"Yes",,,"03/05/09 00:00:00","03/28/18 20:01:12","hlo",0,0,1250,0,"201706",0,7,0,1,0,0,0,0,,0,0
"2180","CITIC Capital China Partners II, L.P.","CITIC Capital China Partners II LP","中國基金二號","中國基金二號",0,"CITIC Capital Partners","CITIC Capital Partners","中信資本控股有限公司","中信資本控股有限公司",0,0,0,"Local",2,"Hong Kong","200903",4,,13,,"10","1+1","2018","200903",0,0,0,0,0,0,0,0,1,"3) Final Closing Achieved already","Closed",750,,,,,0,,"Mgt Fee: 2% of aggregate commitments during the 5-year commitment period;2% of capital contributed thereafter
Carry: 20%
Hurdle:8%","Yes",,,"Yes",,,"03/10/09 00:00:00","04/25/18 11:02:38","hlo",0,0,925,0,"201403",0,6,0,0,0,0,0,0,,0,0
"2181","Nanchang CSM Venture Investment Fund","Nanchang CSM Venture Investment Fund","南昌中科創業投資基金","南昌中科創業投資基金",0,"China Science & Merchants Investment (fund) Management Co., Ltd","China Science & Merchants Investment (fund) Management Co., Ltd","中科招商投資(基金)管理公司","中科招商投資(基金)管理公司",0,0,0,"Local",3,"China","200903",1,,13,"Nanchang, Jiangxi province",,,,"200906",0,0,0,0,0,1,0,0,1,"3) Final Closing Achieved already","Closed",730.90002,,"RMB",5000,,0,,,"Yes",,,"Yes",,1,"03/10/09 00:00:00","01/12/12 00:00:00",,0,0,,,,0,,0,0,0,0,0,0,,0,0
"2182","GSR LED Industrial Fund","GSR LED Industrial Fund","金沙江LED產業基金","金沙江LED產業基金",0,"GSR Ventures","GSR Ventures","金沙江創業投資基金","金沙江創業投資基金",0,1,0,"Local",3,"China","200903",1,,13,"Nanchang",,,,"200906",0,1,0,1,0,1,0,0,1,"3) Final Closing Achieved already","Closed",58.5,73.099998,"RMB",400,500,0,,,"Yes",38,,"Yes",,1,"03/11/09 00:00:00","03/16/18 19:10:31","hlo",0,0,,,,0,2,0,1,0,0,0,0,,0,0
"2194","(Unknown - US$300-400 m PE Fund)","N/A",,,1,"Akansa Capital","Akansa Capital",,,0,1,0,,2,"India","200903",2,,3,"India",,,,"N/A",0,0,0,0,0,0,0,0,0,"6) No further info","N/A",300,400,,,,0,,,"No",,,"No",,,"03/23/09 00:00:00","12/05/12 00:00:00",,0,0,,,,0,,0,0,0,0,0,0,,0,0
"22","ICICI Global Opportunities Fund","ICICI Global Opportunities Fund",,,0,"ICICI Venture Funds Management Co Ltd","ICICI Venture Funds Management Co. Ltd.",,,0,0,0,,3,"India","2000",1,,1,,,,,"N/A",0,0,0,0,0,0,0,0,0,"6) No further info","N/A",175,,,,,1,,,"Yes",,,"No",,,,,,0,0,,,,0,,0,0,0,0,0,0,,0,0
"220","ARIA Private Equity Partners II","ARIA Private Equity Partners II",,,0,"CLSA Capital Partners (former CLSA Private Equity Ltd.)","CLSA Capital Partners",,,0,1,0,,2,"Hong Kong","200212",2,,3,,"8",,"2010","200212",0,0,0,0,0,0,0,0,0,"3) Final Closing Achieved already","Closed",150,,,,,0,,,"Yes",,,"Yes",,,,"05/09/17 09:54:11","hlo",0,0,,,,0,,0,0,0,0,0,0,,0,0
"2207","Carlyle Asia Real Estate Partners II, L.P.","Carlyle Asia Real Estate Partners II LP",,,0,"Carlyle Asia Real Estate, Ltd.","Carlyle Asia Real Estate Ltd",,,0,1,0,,1,"Hong Kong","200710",10,,3,"China & Japan",,,,"2008",0,0,0,0,0,0,0,0,0,"3) Final Closing Achieved already","Closed",1000,,,,,0,,,"Yes",103,,"No",,,"04/01/09 00:00:00","11/09/18 17:14:16","hlo",0,0,,,,0,4,0,1,0,0,0,1,"2018",0,0
"2216","GS Vintage Fund V","GS Vintage Fund V",,,0,"Goldman Sachs Asset Management","Goldman Sachs Asset Management",,,0,0,0,,1,"USA","200904",5,,1,,,,,"200904",0,0,0,0,0,0,0,0,0,"3) Final Closing Achieved already","Closed",,,,,,0,,,"Yes",,,"Yes",,,"04/16/09 00:00:00","11/20/20 11:55:59","hlo",0,0,,,,0,11,0,0,0,0,0,1,"201904",0,0
"2222","Sinovo Alliance Growth Capital Fund","Sinovo Alliance Growth Capital Fund","新開發聯合創業投資企業","新開發聯合創業投資企業",0,"Sinovo Growth Capital Management Co., Ltd.","Sinovo Growth Capital Management Co., Ltd.","新開發創業投資管理有限責任公司","新開發創業投資管理有限責任公司",0,1,0,"Joint Venture (Local-Local)",5,"China","200807",18,"Early Stage: 20% ; Growth/Expansion: 60% ; Pre-IPO: 20%",13,,"12",,"2020","200812",0,1,0,0,0,1,0,0,1,"3) Final Closing Achieved already","Closed",438.5,,"RMB",3000,,0,,,"Yes",,,"Yes",,1,"04/21/09 00:00:00","10/26/16 12:11:35","hlo",0,0,,,,0,,0,0,0,0,0,0,,0,0
"2223",,,,,0,"Sinovo Growth Capital Management Co., Ltd.","Sinovo Growth Capital Management Co., Ltd.","新開發創業投資管理有限責任公司","新開發創業投資管理有限責任公司",1,0,0,"Joint Venture (Local-Local)",5,"China",,,,,,,,,,0,0,0,0,0,0,0,0,0,,,,,,,,0,,,"No",,,"No",,,"04/22/09 00:00:00","04/22/09 00:00:00",,0,0,,,,0,,0,0,0,0,0,0,,0,0
"2252","J.C. Flowers III, L.P.","J.C. Flowers III, L.P.",,,0,"J.C. Flowers & Co. LLC","J.C. Flowers & Co. LLC",,,0,0,0,,1,"USA","200804",4,,1,,,,,"200809",0,0,0,0,0,0,0,0,0,"3) Final Closing Achieved already","Closed",,,,,,0,,"This J.C. Flowers III has a US$4 billion fund parallel fund (Fund ID: 1479) which is sponsored by the China Investment Corp  according to an interview with J. Christopher Flowers by a publication, Mergers & Acquisitions, reported in May 2009.","Yes",,,"Yes",,,"05/20/09 00:00:00","05/20/09 00:00:00",,0,0,,,,0,,0,0,0,0,0,0,,0,0
"2265","CITIC Kazyna Direct Investment Fund I","CITIC Kazyna Direct Investment Fund I","中信卡森納直接投資基金1號","中信卡森納直接投資基金1號",0,"CITIC Capital Holdings Limited, Kazyna Capital Management JSC","CITIC Capital Holdings Limited, Kazyna Capital Management JSC","中信資本控股有限公司, 卡森納資本管理股份公司","中信資本控股有限公司, 卡森納資本管理股份公司",0,0,0,"Joint Venture (Local-Local)",5,"Hong Kong, Kazakhstan","200905",6,,3,"China & Kazakhstan",,,,"200905",0,1,0,0,0,1,0,0,1,"3) Final Closing Achieved already","Closed",200,,,,,0,,,"Yes",148,,"Yes",,,"05/27/09 00:00:00","02/20/12 00:00:00",,0,0,,,,0,,0,1,0,0,0,0,,0,0
"227","Mizuho Advisory, Inc.","Mizuho Advisory, Inc.",,,0,"Mizuho Advisory, Inc.","Mizuho Advisory, Inc.",,,0,0,0,"Local",3,"Japan","200305",8,,18,,,,,"N/A",0,0,0,0,0,0,0,0,0,"6) No further info","N/A",,,,,,0,,,"No",,,"No",,,,,,0,0,,,,0,,0,0,0,0,0,0,,0,0
"2278","Ascent India Fund III","Ascent India Fund III",,,0,"Ascent Capital Advisors India Private Limited (formerly known as UTI Venture Funds Management Co. Pvt. Ltd.)","Ascent Capital Advisors India Pvt Ltd",,,0,1,0,"Local",3,"India","200901",2,,15,,,,,"200912",0,0,0,0,0,0,0,0,0,"3) Final Closing Achieved already","Closed",,,,,,0,,"a.	UTI has agreed to allow UTI Ventures to be an independent fund management firm
b.	Going forward, the arrangement with UTI shall be as follows:-
i.	UTI is to take a 50% stake; while the partners of UTI Ventures or Ascent will be taking 50%, meaning that UTI itself will be getting 50% of the management fee, while the remaining 50% will be for the partners 
ii.	The carried interest split: UTI as an institution has agreed to take 33%; while the management will take 67","Yes",,,"Yes",,,"06/08/09 00:00:00","02/02/18 11:02:18","hlo",0,0,,,,0,,0,0,0,0,0,0,,0,0
"23","India Advantage Fund I","India Advantage Fund I",,,0,"ICICI Venture Funds Management Co Ltd","ICICI Venture Funds Management Co. Ltd.",,,0,0,0,"Local",3,"India","200206",2,,15,,"7","2","2009","200206",0,0,0,0,0,1,0,0,1,"3) Final Closing Achieved already","Closed",160,,,,,1,,"Coller Capital has bought out part of the stakes of some of the existing investors in the India Advantage Fund I in February 2006.","Yes",,,"Yes",,,,"11/18/16 09:58:33","hlo",0,0,,,,0,,0,0,0,0,0,0,,0,0
"2303","Sinowisdom Haiyue Investment Co., Ltd.","Sinowisdom Haiyue Investment Co., Ltd.","浙江華睿海越投資有限公司","浙江華睿海越投資有限公司",0,"Sinowisdom Investment Management Co., Ltd.","Sinowisdom Investment Management Co., Ltd.","浙江華睿投資管理有限公司","浙江華睿投資管理有限公司",0,1,0,"Local",3,"China","200906",2,,13,,,,,"200907",0,1,0,0,0,0,0,0,0,"3) Final Closing Achieved already","Closed",43.900002,73.199997,"RMB",300,500,0,,,"Yes",,,"Yes",,1,"07/02/09 00:00:00","11/30/09 00:00:00",,0,0,,,,0,,0,0,0,0,0,0,,0,0
"2305","Sinowisdom Taixin Venture Investment Co., Ltd.","Sinowisdom Taixin Venture Investment Co., Ltd.","浙江華睿泰信創業投資有限公司","浙江華睿泰信創業投資有限公司",0,"Sinowisdom Investment Management Co., Ltd.","Sinowisdom Investment Management Co., Ltd.","浙江華睿投資管理有限公司","浙江華睿投資管理有限公司",0,1,0,"Local",3,"China","200807",2,,13,,,,,"200807",1,0,0,0,0,1,0,1,1,"3) Final Closing Achieved already","Closed",14.6,,"RMB",100,,0,,,"Yes",,,"Yes",,1,"07/06/09 00:00:00","07/06/09 00:00:00",,0,0,,,,0,,0,0,0,0,0,0,,0,0
"2309","True North Fund IV (formerly known as India Value Fund IV)","True North Fund IV (formerly known as India Value Fund IV)",,,0,"True North Managers (formerly known as India Value Fund Advisors Private Limited)","True North Managers",,,0,1,0,"Local",3,"India","2009",2,,15,,,,,"200906",0,0,0,0,0,0,0,0,0,"3) Final Closing Achieved already","Closed",700,,,,,0,,"In 2012, the fund got downsized by US$125 million, from US$725 million to US$600 million. Because due to their offical website info, we decided to amend the final closing amount to US$600 million instead","Yes",,,"Yes",,,"07/08/09 00:00:00","09/06/18 15:35:42","hlo",0,0,,,,0,5,0,0,0,0,0,0,,0,0
"2316","CDH Venture Partners Fund II","CDH Venture Partners Fund II",,,0,"CDH Venture","CDH Venture","鼎暉創業投資","鼎暉創業投資",0,1,0,"Local",3,"China","200711",1,,13,,"10",,"2017","200711",0,0,0,0,0,0,0,0,0,"3) Final Closing Achieved already","Closed",500,,,,,0,,,"Yes",,,"Yes",,,"07/09/09 00:00:00","04/30/21 16:47:39","hlo",0,0,,,,0,5,0,0,0,0,0,1,"2018",0,0
"2497","Kula Fund II Ltd.","Kula Fund II Ltd.",,,0,"Aureos Capital (through Pacific Capital Partners (PNG) Ltd)","Aureos Capital",,,0,1,0,,2,"Australia","2006",2,,3,"Pacific islands","10",,"2015","200902",0,0,0,0,0,0,1,0,0,"3) Final Closing Achieved already","Closed",22,,,,,0,,,"Yes",,,"Yes",,,"12/07/09 00:00:00","02/20/12 00:00:00",,0,0,,,,0,,0,0,0,0,0,0,,0,0
"2508","Goldman Sachs Tikona Digital Network Investors Offshore L.P","Goldman Sachs Tikona Digital Network Investors Offshore L.P",,,0,"Goldman Sachs, Tikona Digital Network","Goldman Sachs, Tikona Digital Network",,,0,0,0,"Joint Venture (Local-Foreign)",4,"USA, India","200912",1,,3,,,,,"2011",0,0,0,0,0,0,0,0,0,"3) Final Closing Achieved already","Closed",,,,,,0,,,"No",,,"Yes",,,"12/16/09 00:00:00","10/27/14 15:28:13","dlo",0,0,,,,0,,0,0,0,0,0,0,,0,0
"2543","Affinity Asia Pacific Fund IV, L.P.","Affinity Asia Pacific Fund IV LP",,,0,"Affinity Equity Partners","Affinity Equity Partners",,,0,1,0,,2,"Hong Kong","201209",4,,3,,,,,"201303",0,0,0,0,0,0,0,0,0,"3) Final Closing Achieved already","Closed",3000,3500,,,,0,,"LP: North America:38%; Asia: 26%; Europe: 23%; Middle-East:13%","Yes",,,"Yes",,,"02/08/10 00:00:00","09/26/18 16:20:15","hlo",1,0,3800,0,"201712",0,9,0,0,0,0,0,0,,0,0
"2553","Yunfeng Capital Fund I","Yunfeng Capital Fund I","雲鋒基金 I","雲鋒基金 I",1,"Yunfeng Capital","Yunfeng Capital","雲鋒基金","雲鋒基金",0,1,0,"Local",3,"China","201001",2,,13,,,,,"201101",0,1,0,0,0,0,0,1,1,"3) Final Closing Achieved already","Closed",,,,,,0,,"Alibaba.com.cn, Giant Interactive Group, Inc. & Founder of Target Media (阿里巴巴集團董事長馬雲、巨人網路董事長史玉柱、聚眾傳媒創辦人虞鋒)","Yes",,,"Yes",,,"02/24/10 00:00:00","04/10/18 17:18:22","hlo",0,0,,,,0,4,0,0,0,0,0,0,,0,0
"2554","Carlyle-Fosun (Shanghai) Equity Investment Fund Enterprise","Carlyle-Fosun (Shanghai) Equity Investment Fund Enterprise","凱雷復星（上海）股權投資基金企業","凱雷復星（上海）股權投資基金企業",0,"Carlyle-Fosun (Shanghai) Equity Investment and Management Co., Ltd.","Carlyle-Fosun (Shanghai) Equity Investment and Management Co., Ltd.","復星凱雷（上海）股權投資管理有限公司","復星凱雷（上海）股權投資管理有限公司",0,0,0,"Joint Venture (Local-Foreign)",4,"China","201002",2,,13,,,,,"201002",0,1,0,0,0,0,0,0,1,"3) Final Closing Achieved already","Closed",100,,"RMB",682.70001,,0,,,"Yes",,,"Yes",,1,"02/24/10 00:00:00","07/25/14 15:19:55","kshum",0,0,,,,0,,0,0,0,0,0,0,,0,0
"258","LC Fund II","LC Fund II",,,0,"Legend Capital","Legend Capital","君聯資本","君聯資本",0,0,0,"Local",3,"China","2003",1,"only one deal focus on growth capital (offical, based on an interview between Mr Linan Zhu & 21st, dated 15 Mar, 2010)",13,,"8",,,"200312",0,0,0,0,0,0,0,0,0,"3) Final Closing Achieved already","Closed",100,,,,,0,,,"Yes",,,"Yes",,,,"03/06/12 00:00:00",,0,0,,,,0,,0,0,0,0,0,0,,0,0
"2597","Liaoning Costal Economic Development Fund","Liaoning Costal Economic Development Fund","遼寧沿海經濟帶發展基金","遼寧沿海經濟帶發展基金",0,"China Science & Merchants Investment (Fund) Management Co., Ltd","China Science & Merchants Investment (fund) Management Co., Ltd","中科招商創業投資管理公司","中科招商創業投資管理公司",0,0,0,"Local",3,"China","201004",2,,13,"Liaoning province",,,,"N/A",0,0,0,1,0,1,0,0,0,"2) Still in fund raising process","Raising",2930,,"RMB",20000,,0,,,"Yes",,,"Yes",,1,"04/20/10 00:00:00","04/20/10 00:00:00",,0,0,,,,0,,0,0,0,0,0,0,,0,0
"2600","Clean Resources Asia Growth Fund","Clean Resources Asia Growth Fund",,,0,"CLSA Capital Partners Limited","CLSA Capital Partners Limited",,,0,1,0,,2,"Singapore","200911",2,,3,,,,,"200912",0,0,0,1,0,0,1,0,0,"3) Final Closing Achieved already","Closed",200,,,,,0,,,"Yes",151,2,"Yes",,,"04/22/10 00:00:00","05/09/17 09:54:17","hlo",0,0,,,,0,,0,1,1,0,0,0,,0,0
"2604","Sequoia Capital China Growth 2010 Fund, L.P.","Sequoia Capital China Growth 2010 Fund LP",,,0,"Sequoia Capital China","Sequoia Capital China",,,0,1,0,"Foreign",3,"China","201010",2,,13,,,,,"201105",0,0,0,0,0,0,0,0,0,"3) Final Closing Achieved already","Closed",,,,,,0,,,"Yes",,,"Yes",,,"04/23/10 00:00:00","04/12/18 14:56:06","hlo",0,0,,,,0,5,0,0,0,0,0,0,,0,0
"261","Warburg Pincus Private Equity VIII, L.P.","Warburg Pincus Private Equity VIII, L.P.",,,0,"Warburg Pincus","Warburg Pincus",,,0,1,0,,1,"USA","2001",2,,1,,,,,"200204",0,0,0,0,0,0,0,0,0,"3) Final Closing Achieved already","Closed",,,,,,0,,,"Yes",,,"Yes",,,,"07/20/21 14:41:51","hlo",0,0,,,,0,11,0,0,0,0,0,1,"201204",0,0
"2629","India Infrastructure Advantage Fund","India Infrastructure Advantage Fund",,,0,"ICICI Venture Funds Management Company Limited","ICICI Venture Funds Management Co. Ltd.",,,0,0,0,"Local",3,"India","201007",6,,15,,"8",,"2018","201305",0,0,0,0,0,0,0,0,0,"3) Final Closing Achieved already","Closed",750,,,,,0,,,"Yes",148,,"Yes",,,"05/12/10 00:00:00","08/15/17 12:11:54","hlo",0,0,275,0,"201805",0,,0,1,0,0,0,0,,0,0
"263","EQT Asia (ICP-Asia)","EQT Asia (ICP-Asia)",,,0,"EQT Partners ( former Investor Asia Limited)","EQT Partners",,,0,0,0,,2,"Hong Kong","1999",4,,3,"Excluding Japan",,,,"1999",0,0,0,0,0,0,0,0,0,"3) Final Closing Achieved already","Closed",400,,,,,0,,,"Yes",,,"Yes",,,,"01/10/11 00:00:00",,0,0,,,,0,,0,0,0,0,0,0,,0,0
"2644","CITIC Capital Japan Partners II LP","CITIC Capital Japan Partners II LP",,,0,"CITIC Capital Partners Japan Limited","CITIC Capital Partners Japan Ltd",,,0,0,0,"Foreign",2,"Japan","200901",4,,18,,"10",,"2021","201001",0,0,0,0,0,0,0,0,0,"3) Final Closing Achieved already","Closed",384.29999,,"JPY",35000,,0,,"HL (10 Mar, 11): the fund may had already secured the final closing size back in May, 2010 (at that time is the 2nd closing)","Yes",,,"Yes",,5,"05/26/10 00:00:00","05/08/19 15:45:03","hlo",0,0,,,,0,3,0,0,0,0,0,1,"201901",0,0
"2674","Legend Angel Investment Fund","Legend Angel Investment Fund","聯想天使投資基金","聯想天使投資基金",0,"Legend Holdings Co., Ltd.","Legend Holdings Co., Ltd.","聯想控股有限公司","聯想控股有限公司",0,0,0,"Local",3,"China","201006",1,,13,,"5",,"2015","201006",0,0,0,0,0,0,0,0,0,"3) Final Closing Achieved already","Closed",58.599998,,"RMB",400,,0,,,"Yes",,,"Yes",,1,"06/17/10 00:00:00","06/12/18 17:18:41","hlo",0,0,,,,0,2,0,0,0,0,0,1,"2016",0,0
"2707","Baring Asia Private Equity Fund V, L.P.","Baring Asia Private Equity Fund V LP",,,0,"Baring Private Equity Asia Ltd.","Baring Private Equity Asia Ltd",,,0,1,0,,2,"Hong Kong","201007",4,,3,,,,,"201102",0,0,0,0,0,0,0,0,0,"3) Final Closing Achieved already","Closed",1750,,,,,0,,,"Yes",,,"Yes",,,"07/16/10 00:00:00","01/21/20 16:36:24","hlo",1,0,2460,0,"201410",0,8,0,0,0,0,0,0,,0,0
"2708","KKR China Growth Fund L.P.","KKR China Growth Fund LP",,,1,"KKR China Growth Limited","KKR China Growth Limited",,,0,1,0,"Foreign",1,"USA","201007",2,,13,,"5",,"2016","201011",0,0,0,0,0,0,0,0,0,"3) Final Closing Achieved already","Closed",1000,,,,,0,,,"Yes",,,"Yes",,,"07/16/10 00:00:00","10/11/19 19:20:51","hlo",0,0,1000,0,"201511",0,7,0,0,0,0,0,1,"2017",0,0
"2726","BTS India Clean Energy Fund","BTS India Clean Energy Fund",,,0,"BTS Investment Advisors Pvt. Ltd.","BTS Investment Advisors Pvt. Ltd.",,,0,1,0,"Local",3,"India","201007",2,,15,,,,,"201207",0,0,0,0,0,0,0,0,0,"4) Cancelled","N/A",120,,,,,0,,,"No",151,2,"No",,,"07/29/10 00:00:00","02/11/15 11:17:57","dlo",0,0,,,,0,,0,1,1,0,0,0,,0,0
